{"$id":"https://justinahiggins614-cmyk.github.io/signature-ai-image-video-maker/data/schemas/manifest.schema.json","$schema":"http://json-schema.org/draft-07/schema#","description":"pixel-manifest.json — the single authoritative count/identity/version source for Signature AI Pixel. Generated by code/build_manifest.py from the sealed data chunks; every displayed count derives from it.","properties":{"canonical_url":{"type":"string"},"counts":{"properties":{"ads_total":{"type":"integer"},"categories":{"type":"integer"},"category_counts":{"type":"object"},"earliest_ad_id":{"type":"string"},"earliest_good_id":{"type":"string"},"goods_goal":{"type":"integer"},"goods_progress":{"type":"string"},"goods_total":{"type":"integer"},"latest_ad_id":{"type":"string"},"latest_good_id":{"type":"string"}},"required":["goods_total","ads_total"],"type":"object"},"deep_links":{"type":"object"},"engine":{"properties":{"deterministic":{"type":"boolean"},"engine_version":{"type":"string"},"js_sha256":{"type":"string"},"js_url":{"type":"string"},"offline_capable":{"type":"boolean"},"py_sha256":{"type":"string"},"py_url":{"type":"string"},"reproducibility":{"type":"string"},"schema_version":{"type":"string"},"seed_algorithm":{"type":"string"}},"required":["engine_version","js_sha256","py_sha256"],"type":"object"},"generated_at":{"type":"string"},"honesty":{"type":"object"},"identity":{"type":"object"},"index":{"properties":{"ads_index":{"type":"string"},"ads_index_rows":{"type":"integer"},"ads_index_sha256":{"type":"string"},"goods_index":{"type":"string"},"goods_index_rows":{"type":"integer"},"goods_index_sha256":{"type":"string"},"index_version":{"type":"string"}},"required":["goods_index_rows","ads_index_rows"],"type":"object"},"manifest_version":{"type":"string"},"network":{"properties":{"name":{"type":"string"},"site_count":{"type":"integer"},"site_number":{"type":"integer"}},"type":"object"},"qa":{"properties":{"failed":{"type":"array"},"gates":{"type":"string"},"status":{"enum":["PASS","FAIL"]}},"type":"object"},"site_id":{"type":"string"},"site_name":{"type":"string"},"site_url":{"type":"string"}},"required":["manifest_version","site_id","counts","engine","index","qa","generated_at"],"title":"JAH-PIXEL-MANIFEST/1.0","type":"object"}