{
 "manifest_version": "JAH-PIXEL-MANIFEST/1.0",
 "site_id": "SIGNATURE-AI-PIXEL",
 "site_name": "Signature AI Pixel",
 "site_url": "https://justinahiggins614-cmyk.github.io/signature-ai-image-video-maker/",
 "canonical_url": "https://justinahiggins614-cmyk.github.io/signature-ai-image-video-maker/",
 "network": {
  "name": "THE JAH NETWORK",
  "site_number": 22,
  "site_count": 27
 },
 "generated_at": "2026-10-19T08:28:31Z",
 "counts": {
  "goods_total": 185000,
  "goods_goal": 1000000,
  "goods_progress": "185000 / 1000000 GOODS",
  "ads_total": 46350,
  "categories": 24,
  "category_counts": {
   "backpack": 7708,
   "banner": 7709,
   "beach towel": 7708,
   "calendar": 7708,
   "flag": 7708,
   "hat": 7709,
   "hoodie": 7708,
   "keychain": 7708,
   "lunchbox": 7708,
   "mousepad": 7708,
   "mug": 7709,
   "notebook": 7708,
   "number sticker": 7709,
   "phone case": 7709,
   "playing cards": 7708,
   "puzzle": 7708,
   "room poster": 7708,
   "socks": 7708,
   "sticker": 7709,
   "surfboard": 7709,
   "t-shirt": 7709,
   "tote bag": 7708,
   "wall decal": 7708,
   "water bottle": 7708
  },
  "earliest_good_id": "JAH-GOODS-000001",
  "latest_good_id": "JAH-GOODS-185000",
  "earliest_ad_id": "JAH-AD-000001",
  "latest_ad_id": "JAH-AD-046350"
 },
 "identity": {
  "good_id_pattern": "JAH-GOODS-###### (contiguous from 000001, never reused)",
  "pixel_id_pattern": "JAH-PIXEL-###### (artwork identity, numerically aligned with JAH-GOODS-######)",
  "ad_id_pattern": "JAH-AD-###### (contiguous from 000001, never reused)",
  "video_id_pattern": "JAH-PIXEL-VIDEO-###### (video creative of the same-numbered JAH-AD)"
 },
 "engine": {
  "engine_version": "SIGART-V1",
  "schema_version": "JAH-PIXEL-RECORD/1.0",
  "js_url": "https://justinahiggins614-cmyk.github.io/signature-ai-image-video-maker/assets/engine.js",
  "js_sha256": "e171b9983d5b2e78b60433760d89c688bafb5cdaab1086a038b2888509da4e2a",
  "py_url": "https://justinahiggins614-cmyk.github.io/signature-ai-image-video-maker/assets/sigart.py",
  "py_sha256": "2402b31a5a558dbea7036dc3db5109196a527724e95c445976b649216d45980d",
  "deterministic": true,
  "offline_capable": true,
  "seed_algorithm": "xfnv1a(prompt|style|scene) -> mulberry32",
  "reproducibility": "PROMPT + NORMALIZED-PROMPT + ENGINE-VERSION + STYLE-VERSION + SEED + SETTINGS => identical output"
 },
 "index": {
  "index_version": "JAH-PIXEL-INDEX/1.0",
  "goods_index": "data/index/goods.idx.json.gz",
  "goods_index_rows": 185000,
  "goods_index_sha256": "17070225715d46db993caea8e36fd902607fec8b4ee4ed8b064155dc37e1ff6f",
  "ads_index": "data/index/ads.idx.json.gz",
  "ads_index_rows": 46350,
  "ads_index_sha256": "418ed54e0dea44778b6d0eec74bf3f0745d7e18c3fbfb7d5deedb683bc1ee7a0"
 },
 "deep_links": {
  "goods": "https://justinahiggins614-cmyk.github.io/signature-ai-image-video-maker/?goods=JAH-GOODS-000001",
  "pixel": "https://justinahiggins614-cmyk.github.io/signature-ai-image-video-maker/?pixel=JAH-PIXEL-000001",
  "ad": "https://justinahiggins614-cmyk.github.io/signature-ai-image-video-maker/?ad=JAH-AD-000001",
  "catalog": "https://justinahiggins614-cmyk.github.io/signature-ai-image-video-maker/goods-catalog.html",
  "feed": "https://justinahiggins614-cmyk.github.io/signature-ai-image-video-maker/data/pixel-catalog.json"
 },
 "honesty": {
  "free_and_unlimited": "image/video GENERATION is free and unlimited; archive STORAGE is bounded by the catalog",
  "mockup_vs_manufactured": "goods are DESIGN MOCKUPS (printable design mockups), not physically manufactured products",
  "commerce": "product ads are creative records; an ad does not mean a product is manufactured, stocked, or for sale",
  "trademark": "engine is designed not to reproduce trademarked characters/logos/brands (abstraction, not a legal guarantee)"
 },
 "qa": {
  "gates": "G1..G6",
  "status": "PASS",
  "failed": []
 }
}